<?xml version="1.0" encoding="UTF-8"?>
<component  xmlns="http://blazebit.com/jsf/component"
			xmlns:xi="http://www.w3.org/2001/XInclude"
			xmlns:xsi="http://www.w3.org/2001/XMLSchema-instance"
			xsi:schemaLocation="http://blazebit.com/jsf/component ../misc/component.xsd">
	<tag>slider</tag>
	<componentClass>com.blazebit.blazefaces.component.slider.Slider</componentClass>
    <componentHandlerClass>com.blazebit.blazefaces.component.slider.SliderHandler</componentHandlerClass>
	<componentType>com.blazebit.blazefaces.component.Slider</componentType>
	<componentFamily>com.blazebit.blazefaces.component</componentFamily>
	<rendererType>com.blazebit.blazefaces.component.SliderRenderer</rendererType>
	<rendererClass>com.blazebit.blazefaces.component.slider.SliderRenderer</rendererClass>
	<parent>javax.faces.component.UIComponentBase</parent>
    <description>Slider is used to provide input with various customization options like orientation, display modes and skinning.</description>
     <interfaces>
		<interface>
			<name>com.blazebit.blazefaces.component.Widget</name>
		</interface>
		<interface>
			<name>javax.faces.component.behavior.ClientBehaviorHolder</name>
		</interface>
	</interfaces>
	<attributes>
		<xi:include href="./../entities/standard_uicomponent_attributes.xml" parse="text"/>
		<xi:include href="./../entities/widget_var_attribute.xml" parse="text"/>
		<attribute>
			<name>for</name>
			<required>false</required>
			<type>java.lang.String</type>
            <description>Id of the input text that the slider will be used for.</description>
		</attribute>
		<attribute>
			<name>display</name>
			<required>false</required>
			<type>java.lang.String</type>
            <description>Id of the component to display the slider value.</description>
		</attribute>
		<attribute>
			<name>minValue</name>
			<required>false</required>
			<type>java.lang.Integer</type>
			<defaultValue>0</defaultValue>
            <description>Minimum value of the slider. Default is 0.</description>
		</attribute>
		<attribute>
			<name>maxValue</name>
			<required>false</required>
			<type>java.lang.Integer</type>
			<defaultValue>100</defaultValue>
            <description>Maximum value of the slider. Default is 100.</description>
		</attribute>
		<attribute>
			<name>style</name>
			<required>false</required>
			<type>java.lang.String</type>
            <description>Inline style of the container element.</description>
		</attribute>
		<attribute>
			<name>styleClass</name>
			<required>false</required>
			<type>java.lang.String</type>
            <description>Style class of the container element.</description>
		</attribute>
		<attribute>
			<name>animate</name>
			<required>false</required>
			<type>java.lang.Boolean</type>
			<defaultValue>true</defaultValue>
            <description>Boolean value to enable/disable the animated move when background of slider is clicked. Default is true.</description>
		</attribute>
		<attribute>
			<name>type</name>
			<required>false</required>
			<type>java.lang.String</type>
			<defaultValue>horizontal</defaultValue>
            <description>Sets the type of the slider, "horizontal" or "vertical". Default is horizontal.</description>
		</attribute>
		<attribute>
			<name>step</name>
			<required>false</required>
			<type>java.lang.Integer</type>
			<defaultValue>1</defaultValue>
            <description>Fixed pixel increments that the slider move in. Default is 1.</description>
		</attribute>
		<attribute>
			<name>disabled</name>
			<required>false</required>
			<type>java.lang.Boolean</type>
			<defaultValue>false</defaultValue>
            <description>Disables or enables the slider.</description>
		</attribute>
        <attribute>
			<name>onSlideStart</name>
			<required>false</required>
			<type>java.lang.String</type>
            <description>Client side callback to execute when slide begins.</description>
		</attribute>
         <attribute>
			<name>onSlide</name>
			<required>false</required>
			<type>java.lang.String</type>
            <description>Client side callback to execute during sliding.</description>
		</attribute>
        <attribute>
			<name>onSlideEnd</name>
			<required>false</required>
			<type>java.lang.String</type>
            <description>Client side callback to execute when slide ends.</description>
		</attribute>
	</attributes>
	<resources>
		<resource>
			<name>blazefaces.css</name>
		</resource>
		<resource>
			<name>jquery/jquery.js</name>
		</resource>
		<resource>
			<name>blazefaces.js</name>
		</resource>
	</resources>
</component>
