<?xml version="1.0" encoding="UTF-8"?>
<component  xmlns="http://blazebit.com/jsf/component" xmlns:xi="http://www.w3.org/2001/XInclude" xmlns:xsi="http://www.w3.org/2001/XMLSchema-instance" xsi:schemaLocation="http://blazebit.com/jsf/component ../misc/component.xsd">
	<tag>buttonGroup</tag>
	<componentClass>com.blazebit.blazefaces.mobile.component.buttongroup.ButtonGroup</componentClass>
	<componentType>com.blazebit.blazefaces.mobile.ButtonGroup</componentType>
	<componentFamily>com.blazebit.blazefaces.mobile.component</componentFamily>
	<rendererType>com.blazebit.blazefaces.mobile.component.ButtonGroupRenderer</rendererType>
	<rendererClass>com.blazebit.blazefaces.mobile.component.buttongroup.ButtonGroupRenderer</rendererClass>
	<parent>javax.faces.component.UIPanel</parent>
	<attributes>
		<xi:include href="../entities/standard_uicomponent_attributes.xml" xpointer="xpointer(/component/attribute)"/>
        <attribute>
			<name>orientation</name>
			<required>false</required>
			<type>java.lang.String</type>
            <defaultValue>vertical</defaultValue>
		</attribute>
        <attribute>
            <name>style</name>
            <required>false</required>
            <type>java.lang.String</type>
        </attribute>
        <attribute>
            <name>styleClass</name>
            <required>false</required>
            <type>java.lang.String</type>
        </attribute>
	</attributes>
</component>