<?xml version="1.0" encoding="UTF-8"?>
<component  xmlns="http://blazebit.com/jsf/component" xmlns:xi="http://www.w3.org/2001/XInclude" xmlns:xsi="http://www.w3.org/2001/XMLSchema-instance" xsi:schemaLocation="http://blazebit.com/jsf/component ../misc/component.xsd">
	<tag>galleriaOverlay</tag>
	<componentClass>com.blazebit.blazefaces.component.galleria.GalleriaOverlay</componentClass>
	<componentType>com.blazebit.blazefaces.component.GalleriaOverlay</componentType>
	<componentFamily>com.blazebit.blazefaces.component</componentFamily>
    <rendererType>com.blazebit.blazefaces.component.GalleriaOverlayRenderer</rendererType>
	<rendererClass>com.blazebit.blazefaces.component.galleria.GalleriaOverlayRenderer</rendererClass>
	<parent>javax.faces.component.UIColumn</parent>
    <attributes>
        <attribute>
            <name>title</name>
            <required>false</required>
            <type>java.lang.String</type>
        </attribute>
    </attributes>
</component>