<?xml version="1.0" encoding="UTF-8"?>
<component  xmlns="http://blazebit.com/jsf/component" xmlns:xi="http://www.w3.org/2001/XInclude" xmlns:xsi="http://www.w3.org/2001/XMLSchema-instance" xsi:schemaLocation="http://blazebit.com/jsf/component ../misc/component.xsd">
	<tag>lineChart</tag>
	<componentClass>com.blazebit.blazefaces.component.chart.line.LineChart</componentClass>
	<componentType>com.blazebit.blazefaces.component.chart.LineChart</componentType>
	<componentFamily>com.blazebit.blazefaces.component</componentFamily>
	<rendererType>com.blazebit.blazefaces.component.chart.LineChartRenderer</rendererType>
	<rendererClass>com.blazebit.blazefaces.component.chart.line.LineChartRenderer</rendererClass>
	<parent>com.blazebit.blazefaces.component.chart.CartesianChart</parent>
    <interfaces>
		<interface>
			<name>com.blazebit.blazefaces.component.Widget</name>
		</interface>
	</interfaces>
	<attributes>
		<xi:include href="./../entities/standard_uicomponent_attributes.xml" parse="text"/>
		<xi:include href="./../entities/widget_var_attribute.xml" parse="text"/>
		<attribute>
			<name>value</name>
			<required>false</required>
			<type>com.blazebit.blazefaces.model.chart.CartesianChartModel</type>
			<ignoreInComponent>true</ignoreInComponent>
		</attribute>
        <attribute>
			<name>style</name>
			<required>false</required>
			<type>java.lang.String</type>
			<ignoreInComponent>true</ignoreInComponent>
		</attribute>
		<attribute>
			<name>styleClass</name>
			<required>false</required>
			<type>java.lang.String</type>
			<ignoreInComponent>true</ignoreInComponent>
		</attribute>
         <attribute>
			<name>title</name>
			<required>false</required>
			<type>java.lang.String</type>
            <ignoreInComponent>true</ignoreInComponent>
		</attribute>
        <attribute>
			<name>legendPosition</name>
			<required>false</required>
			<type>java.lang.String</type>
            <ignoreInComponent>true</ignoreInComponent>
		</attribute>
		<attribute>
			<name>minY</name>
			<required>false</required>
			<type>java.lang.Double</type>
			<defaultValue>java.lang.Double.MIN_VALUE</defaultValue>
		</attribute>
		<attribute>
			<name>maxY</name>
			<required>false</required>
			<type>java.lang.Double</type>
			<defaultValue>java.lang.Double.MAX_VALUE</defaultValue>
		</attribute>
        <attribute>
			<name>minX</name>
			<required>false</required>
			<type>java.lang.Double</type>
			<defaultValue>java.lang.Double.MIN_VALUE</defaultValue>
		</attribute>
		<attribute>
			<name>maxX</name>
			<required>false</required>
			<type>java.lang.Double</type>
			<defaultValue>java.lang.Double.MAX_VALUE</defaultValue>
		</attribute>
        <attribute>
			<name>breakOnNull</name>
			<required>false</required>
			<type>java.lang.Boolean</type>
			<defaultValue>false</defaultValue>
		</attribute>
        <attribute>
			<name>seriesColors</name>
			<required>false</required>
			<type>java.lang.String</type>
            <ignoreInComponent>true</ignoreInComponent>
		</attribute>
        <attribute>
			<name>shadow</name>
			<required>false</required>
			<type>java.lang.Boolean</type>
        <ignoreInComponent>true</ignoreInComponent>
		</attribute>
       <attribute>
			<name>fill</name>
			<required>false</required>
			<type>java.lang.Boolean</type>
            <defaultValue>false</defaultValue>
		</attribute>
       <attribute>
			<name>stacked</name>
			<required>false</required>
			<type>java.lang.Boolean</type>
            <defaultValue>false</defaultValue>
		</attribute>
       <attribute>
			<name>showMarkers</name>
			<required>false</required>
			<type>java.lang.Boolean</type>
            <defaultValue>true</defaultValue>
		</attribute>
       <attribute>
			<name>xaxisLabel</name>
			<required>false</required>
			<type>java.lang.String</type>
        <ignoreInComponent>true</ignoreInComponent>
		</attribute>
        <attribute>
			<name>yaxisLabel</name>
			<required>false</required>
			<type>java.lang.String</type>
        <ignoreInComponent>true</ignoreInComponent>
		</attribute>
        <attribute>
			<name>xaxisAngle</name>
			<required>false</required>
			<type>java.lang.Integer</type>
        <ignoreInComponent>true</ignoreInComponent>
		</attribute>
        <attribute>
			<name>yaxisAngle</name>
			<required>false</required>
			<type>java.lang.Integer</type>
        <ignoreInComponent>true</ignoreInComponent>
		</attribute>
        <attribute>
			<name>legendCols</name>
			<required>false</required>
			<type>java.lang.Integer</type>
            <ignoreInComponent>true</ignoreInComponent>
            <description>Defines visible column count of chart legend.</description>
		</attribute>
        <attribute>
			<name>legendRows</name>
			<required>false</required>
			<type>java.lang.Integer</type>
            <ignoreInComponent>true</ignoreInComponent>
            <description>Defines visible row count of chart legend.</description>
		</attribute>
        <attribute>
			<name>zoom</name>
			<required>false</required>
			<type>java.lang.Boolean</type>
            <defaultValue>false</defaultValue>
            <description>Enables plot zooming.</description>
		</attribute>
        <attribute>
			<name>extender</name>
			<required>false</required>
			<type>java.lang.Integer</type>
            <ignoreInComponent>true</ignoreInComponent>
            <description>Javascript function to extend the chart with low level jqplot options.</description>
		</attribute>
        <attribute>
			<name>animate</name>
			<required>false</required>
			<type>java.lang.Boolean</type>
            <defaultValue>false</defaultValue>
            <description>Enables animation on plot, default is false.</description>
		</attribute>
        <attribute>
			<name>showDatatip</name>
			<required>false</required>
			<type>java.lang.Boolean</type>
            <defaultValue>true</defaultValue>
            <description>Defines visibility of datatip, default is true.</description>
		</attribute>
        <attribute>
			<name>datatipFormat</name>
			<required>false</required>
			<type>java.lang.String</type>
            <description>Template string for datatips.</description>
		</attribute>
	</attributes>
	<resources>
        <resource>
			<name>charts/charts.css</name>
		</resource>
		<resource>
			<name>jquery/jquery.js</name>
		</resource>
		<resource>
			<name>blazefaces.js</name>
		</resource>
		<resource>
			<name>charts/charts.js</name>
		</resource>
	</resources>
</component>