<?xml version="1.0" encoding="UTF-8"?>
<component  xmlns="http://blazebit.com/jsf/component" xmlns:xi="http://www.w3.org/2001/XInclude" xmlns:xsi="http://www.w3.org/2001/XMLSchema-instance" xsi:schemaLocation="http://blazebit.com/jsf/component ../misc/component.xsd">
	<tag>rowExpansion</tag>
	<componentClass>com.blazebit.blazefaces.component.rowexpansion.RowExpansion</componentClass>
	<componentType>com.blazebit.blazefaces.component.RowExpansion</componentType>
	<componentFamily>com.blazebit.blazefaces.component</componentFamily>
	<parent>javax.faces.component.UIColumn</parent>
    <description>RowExpansion is a helper component of datatable used to implement expandable rows.</description>
	<attributes>
		<xi:include href="./../entities/standard_uicomponent_attributes.xml" parse="text"/>
	</attributes>
</component>