<?xml version="1.0" encoding="UTF-8"?>
<component  xmlns="http://blazebit.com/jsf/component" xmlns:xi="http://www.w3.org/2001/XInclude" xmlns:xsi="http://www.w3.org/2001/XMLSchema-instance" xsi:schemaLocation="http://blazebit.com/jsf/component ../misc/component.xsd">
	<tag>orderList</tag>
	<componentClass>com.blazebit.blazefaces.component.orderlist.OrderList</componentClass>
	<componentType>com.blazebit.blazefaces.component.OrderList</componentType>
	<componentFamily>com.blazebit.blazefaces.component</componentFamily>
	<rendererType>com.blazebit.blazefaces.component.OrderListRenderer</rendererType>
	<rendererClass>com.blazebit.blazefaces.component.orderlist.OrderListRenderer</rendererClass>
	<parent>javax.faces.component.UIInput</parent>
    <description>OrderList is used to sort a collection.</description>
    <interfaces>
		<interface>
			<name>com.blazebit.blazefaces.component.Widget</name>
		</interface>
	</interfaces>
	<attributes>
		<xi:include href="./../entities/input_component_attributes.xml" parse="text"/>
		<xi:include href="./../entities/widget_var_attribute.xml" parse="text"/>
		<attribute>
			<name>var</name>
			<required>false</required>
			<type>java.lang.String</type>
            <description>Name of the iterator.</description>
		</attribute>
		<attribute>
			<name>itemLabel</name>
			<required>false</required>
			<type>java.lang.String</type>
            <description>Label of an item.</description>
		</attribute>
		<attribute>
			<name>itemValue</name>
			<required>false</required>
			<type>java.lang.Object</type>
            <description>Value of an item.</description>
		</attribute>
		<attribute>
			<name>style</name>
			<required>false</required>
			<type>java.lang.String</type>
            <description>Style of the main container.</description>
		</attribute>
		<attribute>
			<name>styleClass</name>
			<required>false</required>
			<type>java.lang.String</type>
            <description>Style class of the main container.</description>
		</attribute>
		<attribute>
			<name>disabled</name>
			<required>false</required>
			<type>java.lang.Boolean</type>
			<defaultValue>false</defaultValue>
            <description>Disables the component.</description>
		</attribute>
        <attribute>
			<name>effect</name>
			<required>false</required>
			<type>java.lang.String</type>
            <description>Name of the animation to display. Default is fade.</description>
		</attribute>
        <attribute>
			<name>moveUpLabel</name>
			<required>false</required>
			<type>java.lang.String</type>
			<defaultValue>Move Up</defaultValue>
            <description>Text of move up button. Default is "Move Up".</description>
		</attribute>
        <attribute>
			<name>moveTopLabel</name>
			<required>false</required>
			<type>java.lang.String</type>
			<defaultValue>Move Top</defaultValue>
            <description>Text of move top button. Default is "Move Top".</description>
		</attribute>
        <attribute>
			<name>moveDownLabel</name>
			<required>false</required>
			<type>java.lang.String</type>
			<defaultValue>Move Down</defaultValue>
            <description>Text of move down button. Default is "Move Down".</description>
		</attribute>
        <attribute>
			<name>moveBottomLabel</name>
			<required>false</required>
			<type>java.lang.String</type>
			<defaultValue>Move Bottom</defaultValue>
            <description>Text of move bottom button. Default is "Move Down".</description>
		</attribute>
        <attribute>
			<name>controlsLocation</name>
			<required>false</required>
			<type>java.lang.String</type>
			<defaultValue>left</defaultValue>
            <description>Location of the order controls, valid values are "left" (default), "right" and none.</description>
		</attribute>
	</attributes>
    <resources>
        <resource>
			<name>blazefaces.css</name>
		</resource>
		<resource>
			<name>jquery/jquery.js</name>
		</resource>
        <resource>
			<name>blazefaces.js</name>
		</resource>
	</resources>
</component>