<?xml version="1.0" encoding="UTF-8"?>
<component  xmlns="http://blazebit.com/jsf/component" xmlns:xi="http://www.w3.org/2001/XInclude" xmlns:xsi="http://www.w3.org/2001/XMLSchema-instance" xsi:schemaLocation="http://blazebit.com/jsf/component ../misc/component.xsd">
	<tag>keyboard</tag>
	<componentClass>com.blazebit.blazefaces.component.keyboard.Keyboard</componentClass>
	<componentType>com.blazebit.blazefaces.component.Keyboard</componentType>
	<componentFamily>com.blazebit.blazefaces.component</componentFamily>
	<rendererType>com.blazebit.blazefaces.component.KeyboardRenderer</rendererType>
	<rendererClass>com.blazebit.blazefaces.component.keyboard.KeyboardRenderer</rendererClass>
	<parent>javax.faces.component.html.HtmlInputText</parent>
    <description>Keyboard is an input component that uses a virtual keyboard to provide the input. Notable features are the customizable layouts and skinning capabilities.</description>
    <interfaces>
		<interface>
			<name>com.blazebit.blazefaces.component.Widget</name>
		</interface>
	</interfaces>
	<attributes>
		<xi:include href="./../entities/input_component_attributes.xml" parse="text"/>
		<xi:include href="./../entities/html_input_text_attributes.xml" parse="text"/>
		<xi:include href="./../entities/widget_var_attribute.xml" parse="text"/>
		<attribute>
			<name>password</name>
			<required>false</required>
			<type>java.lang.Boolean</type>
			<defaultValue>false</defaultValue>
            <description>Makes the input a password field. Default is false.</description>
		</attribute>
		<attribute>
			<name>showMode</name>
			<required>false</required>
			<type>java.lang.String</type>
			<defaultValue>focus</defaultValue>
            <description>Specifies the showMode, 'focus', 'button', 'both'</description>
		</attribute>
		<attribute>
			<name>buttonImage</name>
			<required>false</required>
			<type>java.lang.String</type>
            <description>Image for the button.</description>
		</attribute>
		<attribute>
			<name>buttonImageOnly</name>
			<required>false</required>
			<type>java.lang.Boolean</type>
			<defaultValue>false</defaultValue>
            <description>When set to true only image of the button would be displayed. Default is false.</description>
		</attribute>
		<attribute>
			<name>effect</name>
			<required>false</required>
			<type>java.lang.String</type>
			<defaultValue>fadeIn</defaultValue>
            <description>Effect of the display animation. Default is fadeIn</description>
		</attribute>
		<attribute>
			<name>effectDuration</name>
			<required>false</required>
			<type>java.lang.String</type>
            <description>Length of the display animation.</description>
		</attribute>
		<attribute>
			<name>layout</name>
			<required>false</required>
			<type>java.lang.String</type>
			<defaultValue>qwerty</defaultValue>
            <description>Built-in layout of the keyboard. Default is qwerty.</description>
		</attribute>
		<attribute>
			<name>layoutTemplate</name>
			<required>false</required>
			<type>java.lang.String</type>
            <description>Template of the custom layout.</description>
		</attribute>
		<attribute>
			<name>keypadOnly</name>
			<required>false</required>
			<type>java.lang.Boolean</type>
			<defaultValue>false</defaultValue>
            <description>Specifies displaying a keypad instead of a keyboard. Default is false.</description>
		</attribute>
		<attribute>
			<name>promptLabel</name>
			<required>false</required>
			<type>java.lang.String</type>
            <description>Label of the prompt text.</description>
		</attribute>
		<attribute>
			<name>closeLabel</name>
			<required>false</required>
			<type>java.lang.String</type>
            <description>Label of the close key.</description>
		</attribute>
		<attribute>
			<name>clearLabel</name>
			<required>false</required>
			<type>java.lang.String</type>
            <description>Label of the clear key.</description>
		</attribute>
		<attribute>
			<name>backspaceLabel</name>
			<required>false</required>
			<type>java.lang.String</type>
            <description>Label of the backspace key.</description>
		</attribute>
	</attributes>
	<resources>
        <resource>
			<name>blazefaces.css</name>
		</resource>
        <resource>
			<name>keyboard/keyboard.css</name>
		</resource>
		<resource>
			<name>jquery/jquery.js</name>
		</resource>
		<resource>
			<name>blazefaces.js</name>
		</resource>
		<resource>
			<name>keyboard/keyboard.js</name>
		</resource>
	</resources>
</component>