<?xml version="1.0" encoding="UTF-8"?>
<component  xmlns="http://blazebit.com/jsf/component"
			xmlns:xi="http://www.w3.org/2001/XInclude"
			xmlns:xsi="http://www.w3.org/2001/XMLSchema-instance"
			xsi:schemaLocation="http://blazebit.com/jsf/component ../misc/component.xsd">
	<tag>selectOneMenu</tag>
	<componentClass>com.blazebit.blazefaces.component.selectonemenu.SelectOneMenu</componentClass>
	<componentType>com.blazebit.blazefaces.component.SelectOneMenu</componentType>
	<componentFamily>com.blazebit.blazefaces.component</componentFamily>
	<rendererType>com.blazebit.blazefaces.component.SelectOneMenuRenderer</rendererType>
	<rendererClass>com.blazebit.blazefaces.component.selectonemenu.SelectOneMenuRenderer</rendererClass>
	<parent>javax.faces.component.html.HtmlSelectOneMenu</parent>
    <interfaces>
		<interface>
			<name>com.blazebit.blazefaces.component.Widget</name>
		</interface>
	</interfaces>
	<attributes>
		<xi:include href="./../entities/input_component_attributes.xml" parse="text"/>
		<xi:include href="./../entities/widget_var_attribute.xml" parse="text"/>
        <attribute>
            <name>effect</name>
            <required>false</required>
            <type>java.lang.String</type>
            <defaultValue>fade</defaultValue>
        </attribute>
        <attribute>
            <name>effectSpeed</name>
            <required>false</required>
            <type>java.lang.String</type>
        </attribute>
        <attribute>
            <name>disabled</name>
            <required></required>
            <type>boolean</type>
            <ignoreInComponent>true</ignoreInComponent>
        </attribute>
        <attribute>
            <name>label</name>
            <required></required>
            <type>java.lang.String</type>
            <ignoreInComponent>true</ignoreInComponent>
        </attribute>
        <attribute>
            <name>onchange</name>
            <required></required>
            <type>java.lang.String</type>
            <ignoreInComponent>true</ignoreInComponent>
        </attribute>
        <attribute>
            <name>style</name>
            <required></required>
            <type>java.lang.String</type>
            <ignoreInComponent>true</ignoreInComponent>
        </attribute>
        <attribute>
            <name>styleClass</name>
            <required></required>
            <type>java.lang.String</type>
            <ignoreInComponent>true</ignoreInComponent>
        </attribute>
        <attribute>
            <name>panelStyle</name>
            <required>false</required>
            <type>java.lang.String</type>
        </attribute>
        <attribute>
            <name>panelStyleClass</name>
            <required>false</required>
            <type>java.lang.String</type>
        </attribute>
        <attribute>
            <name>var</name>
            <required>false</required>
            <type>java.lang.String</type>
        </attribute>
        <attribute>
            <name>height</name>
            <required>false</required>
            <type>java.lang.Integer</type>
            <defaultValue>java.lang.Integer.MAX_VALUE</defaultValue>
        </attribute>
        <attribute>
            <name>tabindex</name>
            <required>false</required>
            <type>java.lang.String</type>
            <ignoreInComponent>true</ignoreInComponent>
        </attribute>
        <attribute>
            <name>editable</name>
            <required>false</required>
            <type>java.lang.Boolean</type>
            <defaultValue>false</defaultValue>
        </attribute>
        <attribute>
            <name>onkeydown</name>
            <required></required>
            <type>java.lang.String</type>
            <ignoreInComponent>true</ignoreInComponent>
        </attribute>
        <attribute>
            <name>onkeyup</name>
            <required></required>
            <type>java.lang.String</type>
            <ignoreInComponent>true</ignoreInComponent>
        </attribute>
	</attributes>
    <resources>
        <resource>
			<name>blazefaces.css</name>
		</resource>
		<resource>
			<name>jquery/jquery.js</name>
		</resource>
        <resource>
			<name>blazefaces.js</name>
		</resource>
	</resources>
</component>