<?xml version="1.0" encoding="UTF-8"?>
<component  xmlns="http://blazebit.com/jsf/component" xmlns:xi="http://www.w3.org/2001/XInclude" xmlns:xsi="http://www.w3.org/2001/XMLSchema-instance" xsi:schemaLocation="http://blazebit.com/jsf/component ../misc/component.xsd">
	<tag>selectBooleanCheckbox</tag>
	<componentClass>com.blazebit.blazefaces.component.selectbooleancheckbox.SelectBooleanCheckbox</componentClass>
	<componentType>com.blazebit.blazefaces.component.SelectBooleanCheckbox</componentType>
	<componentFamily>com.blazebit.blazefaces.component</componentFamily>
	<rendererType>com.blazebit.blazefaces.component.SelectBooleanCheckboxRenderer</rendererType>
	<rendererClass>com.blazebit.blazefaces.component.selectbooleancheckbox.SelectBooleanCheckboxRenderer</rendererClass>
	<parent>javax.faces.component.html.HtmlSelectBooleanCheckbox</parent>
    <interfaces>
		<interface>
			<name>com.blazebit.blazefaces.component.Widget</name>
		</interface>
	</interfaces>
	<attributes>
		<xi:include href="./../entities/input_component_attributes.xml" parse="text"/>
        <xi:include href="./../entities/widget_var_attribute.xml" parse="text"/>
        <attribute>
            <name>disabled</name>
            <required></required>
            <type>boolean</type>
            <ignoreInComponent>true</ignoreInComponent>
        </attribute>
        <attribute>
            <name>label</name>
            <required></required>
            <type>java.lang.String</type>
            <ignoreInComponent>true</ignoreInComponent>
        </attribute>
        <attribute>
            <name>onchange</name>
            <required></required>
            <type>java.lang.String</type>
            <ignoreInComponent>true</ignoreInComponent>
        </attribute>
        <attribute>
            <name>style</name>
            <required></required>
            <type>java.lang.String</type>
            <ignoreInComponent>true</ignoreInComponent>
        </attribute>
        <attribute>
            <name>styleClass</name>
            <required></required>
            <type>java.lang.String</type>
            <ignoreInComponent>true</ignoreInComponent>
        </attribute>
        <attribute>
            <name>itemLabel</name>
            <required></required>
            <type>java.lang.String</type>
            <description>Label to display next to checkbox.</description>
        </attribute>
        <attribute>
            <name>tabindex</name>
            <required>false</required>
            <type>java.lang.String</type>
            <ignoreInComponent>true</ignoreInComponent>
            <description>The tabindex attribute specifies the tab order of an element when the "tab" button is used for navigating.</description>
        </attribute>
	</attributes>
    <resources>
        <resource>
			<name>blazefaces.css</name>
		</resource>
		<resource>
			<name>jquery/jquery.js</name>
		</resource>
        <resource>
			<name>blazefaces.js</name>
		</resource>
	</resources>
</component>