<?xml version="1.0" encoding="UTF-8"?>
<component  xmlns="http://blazebit.com/jsf/component" xmlns:xi="http://www.w3.org/2001/XInclude" xmlns:xsi="http://www.w3.org/2001/XMLSchema-instance" xsi:schemaLocation="http://blazebit.com/jsf/component ../misc/component.xsd">
    <tag>progressBar</tag>
    <componentClass>com.blazebit.blazefaces.component.progressbar.ProgressBar</componentClass>
    <componentType>com.blazebit.blazefaces.component.ProgressBar</componentType>
    <componentFamily>com.blazebit.blazefaces.component</componentFamily>
    <rendererType>com.blazebit.blazefaces.component.ProgressBarRenderer</rendererType>
    <rendererClass>com.blazebit.blazefaces.component.progressbar.ProgressBarRenderer</rendererClass>
    <parent>javax.faces.component.UIComponentBase</parent>
    <description>ProgressBar is a process status indicator that can either work purely on client side or interact with server side using ajax.</description>
    <interfaces>
		<interface>
			<name>com.blazebit.blazefaces.component.Widget</name>
		</interface>
        <interface>
			<name>javax.faces.component.behavior.ClientBehaviorHolder</name>
		</interface>
	</interfaces>
    <attributes>
        <xi:include href="./../entities/standard_uicomponent_attributes.xml" parse="text"/>
        <xi:include href="./../entities/widget_var_attribute.xml" parse="text"/>
        <attribute>
            <name>value</name>
            <required>false</required>
            <type>java.lang.Integer</type>
            <defaultValue>0</defaultValue>
            <description>Value of the progress bar. Default is 0.</description>
        </attribute>
        <attribute>
            <name>disabled</name>
            <required>false</required>
            <type>java.lang.Boolean</type>
            <defaultValue>false</defaultValue>
            <description>Disables or enables the progressbar.</description>
        </attribute>
        <attribute>
            <name>ajax</name>
            <required>false</required>
            <type>java.lang.Boolean</type>
            <defaultValue>false</defaultValue>
            <description>Specifies the mode of progressBar, in ajax mode progress value is retrieved from a backing bean. Default is false.</description>
        </attribute>
        <attribute>
            <name>interval</name>
            <required>false</required>
            <type>java.lang.Integer</type>
            <defaultValue>3000</defaultValue>
            <description>Interval in seconds to do periodic requests in ajax mode. Default is 300.</description>
        </attribute>
        <attribute>
            <name>style</name>
            <required>false</required>
            <type>java.lang.String</type>
            <description>Inline style of the main container element.</description>
        </attribute>
        <attribute>
            <name>styleClass</name>
            <required>false</required>
            <type>java.lang.String</type>
            <description>Style class of the main container element.</description>
        </attribute>
        <attribute>
            <name>labelTemplate</name>
            <required>false</required>
            <type>java.lang.String</type>
            <description>Template of the progress value e.g. "{value}%"</description>
        </attribute>
        <attribute>
            <name>displayOnly</name>
            <required>false</required>
            <type>java.lang.Boolean</type>
            <defaultValue>false</defaultValue>
            <description>Enables static value display mode.</description>
        </attribute>
    </attributes>
	<resources>
		<resource>
			<name>blazefaces.css</name>
		</resource>
		<resource>
			<name>jquery/jquery.js</name>
		</resource>
		<resource>
			<name>blazefaces.js</name>
		</resource>
	</resources>
</component>