<?xml version="1.0" encoding="UTF-8"?>
<component  xmlns="http://blazebit.com/jsf/component" xmlns:xi="http://www.w3.org/2001/XInclude" xmlns:xsi="http://www.w3.org/2001/XMLSchema-instance" xsi:schemaLocation="http://blazebit.com/jsf/component ../misc/component.xsd">
	<tag>radioButton</tag>
	<componentClass>com.blazebit.blazefaces.component.radiobutton.RadioButton</componentClass>
	<componentType>com.blazebit.blazefaces.component.RadioButton</componentType>
	<componentFamily>com.blazebit.blazefaces.component</componentFamily>
	<rendererType>com.blazebit.blazefaces.component.RadioButtonRenderer</rendererType>
	<rendererClass>com.blazebit.blazefaces.component.radiobutton.RadioButtonRenderer</rendererClass>
	<parent>javax.faces.component.UIComponentBase</parent>
    <interfaces>
		<interface>
			<name>com.blazebit.blazefaces.component.Widget</name>
		</interface>
	</interfaces>
	<attributes>
		<xi:include href="./../entities/standard_uicomponent_attributes.xml" parse="text"/>
        <xi:include href="./../entities/widget_var_attribute.xml" parse="text"/>
        <attribute>
            <name>disabled</name>
            <required>false</required>
            <type>java.lang.Boolean</type>
            <defaultValue>false</defaultValue>
            <description>Disables the component.</description>
        </attribute>
        <attribute>
            <name>itemIndex</name>
            <required>false</required>
            <type>java.lang.Integer</type>
            <description>Index of the selectItem of the selectOneRadio.</description>
        </attribute>
        <attribute>
            <name>onchange</name>
            <required>false</required>
            <type>java.lang.String</type>
            <description>Client side callback to execute on state change.</description>
        </attribute>
        <attribute>
            <name>for</name>
            <required>false</required>
            <type>java.lang.String</type>
            <description>Id of the selectOneRadio component to attach to.</description>
        </attribute>
        <attribute>
            <name>style</name>
            <required></required>
            <type>java.lang.String</type>
            <description>Inline style of the component.</description>
        </attribute>
        <attribute>
            <name>styleClass</name>
            <required></required>
            <type>java.lang.String</type>
            <description>Style class of the component.</description>
        </attribute>
	</attributes>
    <resources>
        <resource>
			<name>blazefaces.css</name>
		</resource>
		<resource>
			<name>jquery/jquery.js</name>
		</resource>
        <resource>
			<name>blazefaces.js</name>
		</resource>
	</resources>
</component>