<?xml version="1.0" encoding="UTF-8"?>
<component  xmlns="http://blazebit.com/jsf/component" xmlns:xi="http://www.w3.org/2001/XInclude" xmlns:xsi="http://www.w3.org/2001/XMLSchema-instance" xsi:schemaLocation="http://blazebit.com/jsf/component ../misc/component.xsd">
    <tag>dialog</tag>
    <componentClass>com.blazebit.blazefaces.component.dialog.Dialog</componentClass>
    <componentType>com.blazebit.blazefaces.component.Dialog</componentType>
    <componentFamily>com.blazebit.blazefaces.component</componentFamily>
    <rendererType>com.blazebit.blazefaces.component.DialogRenderer</rendererType>
    <rendererClass>com.blazebit.blazefaces.component.dialog.DialogRenderer</rendererClass>
    <parent>javax.faces.component.UIPanel</parent>
    <description>Dialog is a panel component overlaying other elements. Dialog avoids popup blockers, provides customization, resizing, modality, ajax interactions and more.</description>
    <interfaces>
		<interface>
			<name>com.blazebit.blazefaces.component.Widget</name>
		</interface>
        <interface>
			<name>javax.faces.component.behavior.ClientBehaviorHolder</name>
		</interface>
	</interfaces>
    <attributes>
        <xi:include href="./../entities/standard_uicomponent_attributes.xml" parse="text"/>
        <xi:include href="./../entities/widget_var_attribute.xml" parse="text"/>
        <attribute>
            <name>header</name>
            <required>false</required>
            <type>java.lang.String</type>
            <description>Text of the header.</description>
        </attribute>
        <attribute>
            <name>draggable</name>
            <required>false</required>
            <type>java.lang.Boolean</type>
            <defaultValue>true</defaultValue>
            <description>Specifies draggability. Default is true.</description>
        </attribute>
        <attribute>
            <name>resizable</name>
            <required>false</required>
            <type>java.lang.Boolean</type>
            <defaultValue>true</defaultValue>
            <description>Specifies resizability. Default is true.</description>
        </attribute>
        <attribute>
            <name>modal</name>
            <required>false</required>
            <type>java.lang.Boolean</type>
            <defaultValue>false</defaultValue>
            <description>Boolean value that specifies whether the document should be shielded with a partially transparent mask to require the user to close the Panel before being able to activate any elements in the document. Default is false.</description>
        </attribute>
        <attribute>
            <name>visible</name>
            <required>false</required>
            <type>java.lang.Boolean</type>
            <defaultValue>false</defaultValue>
            <description>Sets dialogs visibility. Default is false.</description>
        </attribute>
        <attribute>
            <name>width</name>
            <required>false</required>
            <type>java.lang.String</type>
            <description>Width of the dialog in pixels. Default is auto.</description>
        </attribute>
        <attribute>
            <name>height</name>
            <required>false</required>
            <type>java.lang.String</type>
            <description>Height of the dialog.</description>
        </attribute>
        <attribute>
            <name>minWidth</name>
            <required>false</required>
            <type>java.lang.Integer</type>
            <defaultValue>java.lang.Integer.MIN_VALUE</defaultValue>
            <description>Minimum width of a resizable dialog. Default is unl.</description>
        </attribute>
        <attribute>
            <name>minHeight</name>
            <required>false</required>
            <type>java.lang.Integer</type>
            <defaultValue>java.lang.Integer.MIN_VALUE</defaultValue>
            <description>Minimum height of a resizable dialog. Default is height of titlebar.</description>
        </attribute>
        <attribute>
            <name>style</name>
            <required>false</required>
            <type>java.lang.String</type>
            <description>Inline style of the dialog container.</description>
        </attribute>
        <attribute>
            <name>styleClass</name>
            <required>false</required>
            <type>java.lang.String</type>
            <description>Style class of the dialog container.</description>
        </attribute>
        <attribute>
            <name>showEffect</name>
            <required>false</required>
            <type>java.lang.String</type>
            <description>Effect to use when showing the dialog.</description>
        </attribute>
        <attribute>
            <name>hideEffect</name>
            <required>false</required>
            <type>java.lang.String</type>
            <description>Effect to use when hiding the dialog.</description>
        </attribute>
        <attribute>
            <name>position</name>
            <required>false</required>
            <type>java.lang.String</type>
            <description>Defines where the dialog should be displayed.</description>
        </attribute>
        <attribute>
            <name>closable</name>
            <required>false</required>
            <type>java.lang.Boolean</type>
            <defaultValue>true</defaultValue>
            <description>Defines if close icon should be displayed or not.</description>
        </attribute>
        <attribute>
            <name>onShow</name>
            <required>false</required>
            <type>java.lang.String</type>
            <description>Client side callback to execute when dialog is displayed.</description>
        </attribute>
        <attribute>
            <name>onHide</name>
            <required>false</required>
            <type>java.lang.String</type>
            <description>Client side callback to execute when dialog is hidden.</description>
        </attribute>
        <attribute>
            <name>appendToBody</name>
            <required>false</required>
            <type>java.lang.Boolean</type>
            <defaultValue>false</defaultValue>
            <description>Appends dialog as a child of document body.</description>
        </attribute>
        <attribute>
            <name>showHeader</name>
            <required>false</required>
            <type>java.lang.Boolean</type>
            <defaultValue>true</defaultValue>
            <description>Specifies visibility of header content.</description>
        </attribute>
        <attribute>
            <name>footer</name>
            <required>false</required>
            <type>java.lang.String</type>
            <description>Text of the footer.</description>
        </attribute>
        <attribute>
            <name>dynamic</name>
            <required>false</required>
            <type>java.lang.Boolean</type>
            <defaultValue>false</defaultValue>
            <description>Dynamic mode allows dialog to fetch it's contents before it's shown rather than on page load
            which is useful to reduce initial page load times. Default is false.</description>
        </attribute>
        <attribute>
            <name>minimizable</name>
            <required>false</required>
            <type>java.lang.Boolean</type>
            <defaultValue>false</defaultValue>
            <description>Specifies if dialog is minimizable or not. Default false.</description>
        </attribute>
        <attribute>
            <name>maximizable</name>
            <required>false</required>
            <type>java.lang.Boolean</type>
            <defaultValue>false</defaultValue>
            <description>Specifies if dialog is maximizable or not. Default false.</description>
        </attribute>
    </attributes>
    <resources>
        <resource>
			<name>blazefaces.css</name>
		</resource>
		<resource>
			<name>jquery/jquery.js</name>
		</resource>
        <resource>
			<name>blazefaces.js</name>
		</resource>
	</resources>
</component>