<?xml version="1.0" encoding="UTF-8"?>
<component  xmlns="http://blazebit.com/jsf/component" xmlns:xi="http://www.w3.org/2001/XInclude" xmlns:xsi="http://www.w3.org/2001/XMLSchema-instance" xsi:schemaLocation="http://blazebit.com/jsf/component ../misc/component.xsd">
    <tag>idleMonitor</tag>
    <componentClass>com.blazebit.blazefaces.component.idlemonitor.IdleMonitor</componentClass>
    <componentType>com.blazebit.blazefaces.component.IdleMonitor</componentType>
    <componentFamily>com.blazebit.blazefaces.component</componentFamily>
    <rendererType>com.blazebit.blazefaces.component.IdleMonitorRenderer</rendererType>
    <rendererClass>com.blazebit.blazefaces.component.idlemonitor.IdleMonitorRenderer</rendererClass>
    <parent>javax.faces.component.UIComponentBase</parent>
    <description>IdleMonitor watches user actions on a page and notify several callbacks in case they go idle or active again.</description>
    <interfaces>
		<interface>
			<name>com.blazebit.blazefaces.component.Widget</name>
		</interface>
        <interface>
			<name>javax.faces.component.behavior.ClientBehaviorHolder</name>
		</interface>
	</interfaces>
    <attributes>
        <xi:include href="./../entities/standard_uicomponent_attributes.xml" parse="text"/>
        <xi:include href="./../entities/widget_var_attribute.xml" parse="text"/>
        <attribute>
            <name>timeout</name>
            <required>false</required>
            <type>java.lang.Integer</type>
            <defaultValue>300000</defaultValue>
            <description>Time to wait in milliseconds until deciding if the user is idle. Default is 5 minutes.</description>
        </attribute>
        <attribute>
            <name>onidle</name>
            <required>false</required>
            <type>java.lang.String</type>
            <description>Client side callback to execute when user goes idle.</description>
        </attribute>
        <attribute>
            <name>onactive</name>
            <required>false</required>
            <type>java.lang.String</type>
            <description>Client side callback to execute when user goes idle.</description>
        </attribute>
    </attributes>
    <resources>
        <resource>
            <name>jquery/jquery.js</name>
        </resource>
        <resource>
            <name>blazefaces.js</name>
        </resource>
        <resource>
            <name>idlemonitor/idlemonitor.js</name>
        </resource>
    </resources>
</component>