<?xml version="1.0" encoding="UTF-8"?>
<component  xmlns="http://blazebit.com/jsf/component" xmlns:xi="http://www.w3.org/2001/XInclude" xmlns:xsi="http://www.w3.org/2001/XMLSchema-instance" xsi:schemaLocation="http://blazebit.com/jsf/component ../misc/component.xsd">
    <tag>dataGrid</tag>
    <componentClass>com.blazebit.blazefaces.component.datagrid.DataGrid</componentClass>
    <componentType>com.blazebit.blazefaces.component.DataGrid</componentType>
    <componentFamily>com.blazebit.blazefaces.component</componentFamily>
    <rendererType>com.blazebit.blazefaces.component.DataGridRenderer</rendererType>
    <rendererClass>com.blazebit.blazefaces.component.datagrid.DataGridRenderer</rendererClass>
    <parent>com.blazebit.blazefaces.component.UIData</parent>
    <description>DataGrid displays a collection of data in grid layout. Ajax Pagination is a built-in feature and paginator UI is fully customizable via various options like paginatorTemplate, rowPerPageOptions, pageLinks and more.</description>
    <interfaces>
		<interface>
			<name>com.blazebit.blazefaces.component.Widget</name>
		</interface>
	</interfaces>
    <attributes>
        <xi:include href="./../entities/data_component_attributes.xml" parse="text"/>
        <xi:include href="./../entities/widget_var_attribute.xml" parse="text"/>
        <attribute>
            <name>columns</name>
            <required>false</required>
            <type>java.lang.Integer</type>
            <defaultValue>3</defaultValue>
            <description>Number of columns of grid. Default is 3.</description>
        </attribute>
        <attribute>
            <name>paginator</name>
            <required>false</required>
            <type>java.lang.Boolean</type>
            <defaultValue>false</defaultValue>
            <ignoreInComponent>true</ignoreInComponent>
            <description>Enables pagination.</description>
        </attribute>
        <attribute>
            <name>paginatorTemplate</name>
            <required>false</required>
            <type>java.lang.String</type>
            <ignoreInComponent>true</ignoreInComponent>
            <description>Template of the paginator.</description>
        </attribute>
        <attribute>
            <name>rowsPerPageTemplate</name>
            <required>false</required>
            <type>java.lang.String</type>
            <ignoreInComponent>true</ignoreInComponent>
            <description>Template of the rowsPerPage dropdown.</description>
        </attribute>
        <attribute>
            <name>currentPageReportTemplate</name>
            <required>false</required>
            <type>java.lang.String</type>
            <ignoreInComponent>true</ignoreInComponent>
            <description>Template of the currentPageReport UI.</description>
        </attribute>
        <attribute>
            <name>pageLinks</name>
            <required>false</required>
            <type>java.lang.Integer</type>
            <defaultValue>10</defaultValue>
            <ignoreInComponent>true</ignoreInComponent>
            <description>Maximum number of page links to display. Default is 10.</description>
        </attribute>
        <attribute>
            <name>paginatorPosition</name>
            <required>false</required>
            <type>java.lang.String</type>
            <defaultValue>both</defaultValue>
            <ignoreInComponent>true</ignoreInComponent>
            <description>Position of the paginator. Default is both.</description>
        </attribute>
        <attribute>
            <name>paginatorAlwaysVisible</name>
            <required>false</required>
            <type>java.lang.Boolean</type>
            <defaultValue>true</defaultValue>
            <ignoreInComponent>true</ignoreInComponent>
            <description>Defines if paginator should be hidden if total data count is less than number of rows per page. Default is true.</description>
        </attribute>
        <attribute>
            <name>style</name>
            <required>false</required>
            <type>java.lang.String</type>
            <description>Inline style of the main container.</description>
        </attribute>
        <attribute>
            <name>styleClass</name>
            <required>false</required>
            <type>java.lang.String</type>
            <description>Style class of the main container.</description>
        </attribute>
        <attribute>
            <name>rowIndexVar</name>
            <required>false</required>
            <type>java.lang.String</type>
            <ignoreInComponent>true</ignoreInComponent>
            <description>Name of iterator to refer each row index.</description>
        </attribute>
        <attribute>
			<name>emptyMessage</name>
			<required>false</required>
			<type>java.lang.String</type>
            <defaultValue>No records found.</defaultValue>
            <description>Text to display when there is no data to display. Default is "No records found."</description>
		</attribute>
        <attribute>
			<name>lazy</name>
			<required>false</required>
			<type>java.lang.Boolean</type>
            <ignoreInComponent>true</ignoreInComponent>
            <description>Defines if lazy loading is enabled for the data component.</description>
		</attribute>
    </attributes>
    <resources>
        <resource>
			<name>blazefaces.css</name>
		</resource>
		<resource>
			<name>jquery/jquery.js</name>
		</resource>
		<resource>
			<name>blazefaces.js</name>
		</resource>
	</resources>
</component>