<?xml version="1.0" encoding="UTF-8"?>
<component  xmlns="http://blazebit.com/jsf/component" xmlns:xi="http://www.w3.org/2001/XInclude" xmlns:xsi="http://www.w3.org/2001/XMLSchema-instance" xsi:schemaLocation="http://blazebit.com/jsf/component ../misc/component.xsd">
    <tag>rating</tag>
    <componentClass>com.blazebit.blazefaces.component.rating.Rating</componentClass>
    <componentType>com.blazebit.blazefaces.component.Rating</componentType>
    <componentFamily>com.blazebit.blazefaces.component</componentFamily>
    <rendererType>com.blazebit.blazefaces.component.RatingRenderer</rendererType>
    <rendererClass>com.blazebit.blazefaces.component.rating.RatingRenderer</rendererClass>
    <parent>javax.faces.component.UIInput</parent>
    <description>Rating component features a star based rating system. Rating can be used as a plain input component or with ajax RateListeners.</description>
    <interfaces>
		<interface>
			<name>com.blazebit.blazefaces.component.Widget</name>
		</interface>
        <interface>
			<name>javax.faces.component.behavior.ClientBehaviorHolder</name>
		</interface>
	</interfaces>
    <attributes>
        <xi:include href="./../entities/input_component_attributes.xml" parse="text"/>
        <xi:include href="./../entities/widget_var_attribute.xml" parse="text"/>
        <attribute>
            <name>stars</name>
            <required>false</required>
            <type>java.lang.Integer</type>
            <defaultValue>5</defaultValue>
            <description>Number of stars to display. Default is 5.</description>
        </attribute>
        <attribute>
            <name>disabled</name>
            <required>false</required>
            <type>java.lang.Boolean</type>
            <defaultValue>false</defaultValue>
            <description>Disables user interaction.</description>
        </attribute>
        <attribute>
            <name>readonly</name>
            <required>false</required>
            <type>java.lang.Boolean</type>
            <defaultValue>false</defaultValue>
            <description>Disables user interaction without adding disabled visuals.</description>
        </attribute>
        <attribute>
            <name>onRate</name>
            <required>false</required>
            <type>java.lang.String</type>
            <description>Client side callback to execute when rate happens.</description>
        </attribute>
        <attribute>
            <name>style</name>
            <required>false</required>
            <type>java.lang.String</type>
            <description>Inline style of the component.</description>
        </attribute>
        <attribute>
            <name>styleClass</name>
            <required>false</required>
            <type>java.lang.String</type>
            <description>Style class of the component.</description>
        </attribute>
        <attribute>
            <name>cancel</name>
            <required>false</required>
            <type>java.lang.Boolean</type>
            <defaultValue>true</defaultValue>
            <description>When enabled, displays a cancel icon to reset rating value, defaults to true.</description>
        </attribute>
    </attributes>
    <resources>
        <resource>
            <name>blazefaces.css</name>
        </resource>
        <resource>
            <name>jquery/jquery.js</name>
        </resource>
        <resource>
            <name>blazefaces.js</name>
        </resource>
    </resources>
</component>
