<?xml version="1.0" encoding="UTF-8"?>
<component  xmlns="http://blazebit.com/jsf/component"
			xmlns:xi="http://www.w3.org/2001/XInclude"
			xmlns:xsi="http://www.w3.org/2001/XMLSchema-instance"
			xsi:schemaLocation="http://blazebit.com/jsf/component ../misc/component.xsd">
	<tag>toolbar</tag>
	<componentClass>com.blazebit.blazefaces.component.toolbar.Toolbar</componentClass>
	<componentType>com.blazebit.blazefaces.component.Toolbar</componentType>
	<componentFamily>com.blazebit.blazefaces.component</componentFamily>
	<rendererType>com.blazebit.blazefaces.component.ToolbarRenderer</rendererType>
	<rendererClass>com.blazebit.blazefaces.component.toolbar.ToolbarRenderer</rendererClass>
	<parent>javax.faces.component.UIComponentBase</parent>
    <description>Toolbar is a horizontal grouping component for commands and other content.</description>
	<attributes>
		<xi:include href="./../entities/standard_uicomponent_attributes.xml" parse="text"/>
        <attribute>
			<name>style</name>
			<required>false</required>
			<type>java.lang.String</type>
            <description>Inline style of the container element.</description>
		</attribute>
        <attribute>
			<name>styleClass</name>
			<required>false</required>
			<type>java.lang.String</type>
            <description>Style class of the container element.</description>
		</attribute>
	</attributes>
    <resources>
		<resource>
			<name>blazefaces.css</name>
		</resource>
    </resources>
</component>
